{
  "schema_version": "1.0",
  "receipt_id": "2026-06-18_shufersal_D00060618",
  "demo": true,
  "source_image": null,
  "scanned_at": "2026-06-18T17:14:00",
  "merchant": {
    "name": "שופרסל שלי",
    "name_en": "Shufersal Sheli",
    "slug": "shufersal",
    "branch": "כפר יונה",
    "tax_id": "520022732",
    "phone": null,
    "address": null
  },
  "document": {
    "type": "invoice_receipt",
    "number": "D00060618",
    "is_copy": false,
    "register": "1"
  },
  "purchased_at": "2026-06-18T17:14",
  "currency": "ILS",
  "items": [
    {
      "line": 1,
      "barcode": "7290110114923",
      "name": "עגבניות שרי 250 גרם",
      "name_en": "Cherry tomatoes 250g",
      "category": "produce",
      "quantity": 2.0,
      "unit": "each",
      "unit_price": 9.14,
      "total": 18.28,
      "size": {
        "value": 250,
        "unit": "g"
      },
      "discount": null,
      "vat_exempt": false,
      "confidence": 0.95,
      "notes": null
    },
    {
      "line": 2,
      "barcode": "7290000537566",
      "name": "נקניקיות עוף 400 גרם",
      "name_en": "Chicken sausages 400g",
      "category": "meat_fish",
      "quantity": 1.0,
      "unit": "each",
      "unit_price": 16.87,
      "total": 16.87,
      "size": {
        "value": 400,
        "unit": "g"
      },
      "discount": null,
      "vat_exempt": false,
      "confidence": 0.95,
      "notes": null
    },
    {
      "line": 3,
      "barcode": "14033",
      "name": "בצל יבש ישראל",
      "name_en": "Dry onion, Israel",
      "category": "produce",
      "quantity": 0.524,
      "unit": "kg",
      "unit_price": 7.32,
      "total": 3.84,
      "size": null,
      "discount": null,
      "vat_exempt": false,
      "confidence": 0.95,
      "notes": null
    },
    {
      "line": 4,
      "barcode": "122269",
      "name": "קבב הבית",
      "name_en": "House kebab",
      "category": "meat_fish",
      "quantity": 0.982,
      "unit": "kg",
      "unit_price": 66.14,
      "total": 64.95,
      "size": null,
      "discount": null,
      "vat_exempt": false,
      "confidence": 0.95,
      "notes": null
    },
    {
      "line": 5,
      "barcode": "7290103992873",
      "name": "נייר טואלט 32 גליל",
      "name_en": "Toilet paper, 32 rolls",
      "category": "household",
      "quantity": 1.0,
      "unit": "each",
      "unit_price": 51.74,
      "total": 51.74,
      "size": null,
      "discount": null,
      "vat_exempt": false,
      "confidence": 0.95,
      "notes": null
    },
    {
      "line": 6,
      "barcode": "7290004720018",
      "name": "קוטג' תנובה 5%",
      "name_en": "Cottage cheese 5%",
      "category": "dairy_eggs",
      "quantity": 1.0,
      "unit": "each",
      "unit_price": 8.04,
      "total": 8.04,
      "size": null,
      "discount": null,
      "vat_exempt": false,
      "confidence": 0.95,
      "notes": null
    },
    {
      "line": 7,
      "barcode": "7290102393916",
      "name": "אורז בסמטי 1 ק\"ג",
      "name_en": "Basmati rice 1kg",
      "category": "pantry",
      "quantity": 1.0,
      "unit": "each",
      "unit_price": 14.94,
      "total": 14.94,
      "size": {
        "value": 1,
        "unit": "kg"
      },
      "discount": null,
      "vat_exempt": false,
      "confidence": 0.95,
      "notes": null
    },
    {
      "line": 8,
      "barcode": "7290013558718",
      "name": "פטריות שמפניון א.א 300",
      "name_en": "Champignon mushrooms 300g",
      "category": "produce",
      "quantity": 1.0,
      "unit": "each",
      "unit_price": 12.12,
      "total": 12.12,
      "size": {
        "value": 300,
        "unit": "g"
      },
      "discount": null,
      "vat_exempt": false,
      "confidence": 0.95,
      "notes": null
    },
    {
      "line": 9,
      "barcode": "4066600999614",
      "name": "פאולנר בקבוק זכ' 500 מ\"ל",
      "name_en": "Paulaner bottle 500ml",
      "category": "alcohol",
      "quantity": 1.0,
      "unit": "each",
      "unit_price": 13.37,
      "total": 13.37,
      "size": {
        "value": 500,
        "unit": "ml"
      },
      "discount": null,
      "vat_exempt": false,
      "confidence": 0.95,
      "notes": null
    },
    {
      "line": 10,
      "barcode": "7290000119946",
      "name": "במבה אסם 80 גרם",
      "name_en": "Bamba 80g",
      "category": "snacks_sweets",
      "quantity": 1.0,
      "unit": "each",
      "unit_price": 4.12,
      "total": 4.12,
      "size": {
        "value": 80,
        "unit": "g"
      },
      "discount": null,
      "vat_exempt": false,
      "confidence": 0.95,
      "notes": null
    }
  ],
  "totals": {
    "items_count": 10,
    "subtotal": 208.27,
    "discount_total": 0,
    "total": 208.27,
    "vat_rate": 0.18,
    "vat_amount": 31.77,
    "vat_taxable": 176.5,
    "vat_exempt": 0
  },
  "payment": {
    "method": "credit",
    "amount": 208.27,
    "change": 0,
    "card_brand": "ויזה כאל",
    "card_last4": "7462",
    "terminal": "2656917",
    "auth_code": null
  },
  "review": {
    "overall_confidence": 1.0,
    "needs_human_check": [],
    "notes": "Synthetic demo receipt generated by scripts/make_demo_data.py — not a real purchase."
  }
}
