{
  "schema_version": "1.0",
  "receipt_id": "2026-06-04_rami-levy_D00050604",
  "demo": true,
  "source_image": null,
  "scanned_at": "2026-06-04T11:14:00",
  "merchant": {
    "name": "רמי לוי שיווק השקמה",
    "name_en": "Rami Levy",
    "slug": "rami-levy",
    "branch": "נתניה",
    "tax_id": "512534303",
    "phone": null,
    "address": null
  },
  "document": {
    "type": "invoice_receipt",
    "number": "D00050604",
    "is_copy": false,
    "register": "1"
  },
  "purchased_at": "2026-06-04T11:14",
  "currency": "ILS",
  "items": [
    {
      "line": 1,
      "barcode": "14201",
      "name": "מלפפון",
      "name_en": "Cucumber",
      "category": "produce",
      "quantity": 0.425,
      "unit": "kg",
      "unit_price": 6.22,
      "total": 2.64,
      "size": null,
      "discount": null,
      "vat_exempt": false,
      "confidence": 0.95,
      "notes": null
    },
    {
      "line": 2,
      "barcode": "7290000208831",
      "name": "שמן זית 750 מ\"ל",
      "name_en": "Olive oil 750ml",
      "category": "pantry",
      "quantity": 1.0,
      "unit": "each",
      "unit_price": 33.77,
      "total": 33.77,
      "size": {
        "value": 750,
        "unit": "ml"
      },
      "discount": null,
      "vat_exempt": false,
      "confidence": 0.95,
      "notes": null
    },
    {
      "line": 3,
      "barcode": "7290011462000",
      "name": "חומוס ביתי /מטבחה/ירושל",
      "name_en": "Home-style hummus",
      "category": "deli_prepared",
      "quantity": 1.0,
      "unit": "each",
      "unit_price": 10.99,
      "total": 10.99,
      "size": null,
      "discount": null,
      "vat_exempt": false,
      "confidence": 0.95,
      "notes": null
    },
    {
      "line": 4,
      "barcode": "7290000537566",
      "name": "נקניקיות עוף 400 גרם",
      "name_en": "Chicken sausages 400g",
      "category": "meat_fish",
      "quantity": 2.0,
      "unit": "each",
      "unit_price": 13.42,
      "total": 26.84,
      "size": {
        "value": 400,
        "unit": "g"
      },
      "discount": null,
      "vat_exempt": false,
      "confidence": 0.95,
      "notes": null
    },
    {
      "line": 5,
      "barcode": "7290008757775",
      "name": "שניצל עוף טרי",
      "name_en": "Fresh chicken schnitzel",
      "category": "meat_fish",
      "quantity": 0.393,
      "unit": "kg",
      "unit_price": 39.26,
      "total": 15.43,
      "size": null,
      "discount": null,
      "vat_exempt": false,
      "confidence": 0.95,
      "notes": null
    },
    {
      "line": 6,
      "barcode": "7290110114923",
      "name": "עגבניות שרי 250 גרם",
      "name_en": "Cherry tomatoes 250g",
      "category": "produce",
      "quantity": 2.0,
      "unit": "each",
      "unit_price": 7.68,
      "total": 15.36,
      "size": {
        "value": 250,
        "unit": "g"
      },
      "discount": null,
      "vat_exempt": false,
      "confidence": 0.95,
      "notes": null
    },
    {
      "line": 7,
      "barcode": "100103",
      "name": "בגט",
      "name_en": "Baguette",
      "category": "bakery",
      "quantity": 1.0,
      "unit": "each",
      "unit_price": 5.15,
      "total": 5.15,
      "size": null,
      "discount": null,
      "vat_exempt": false,
      "confidence": 0.95,
      "notes": null
    },
    {
      "line": 8,
      "barcode": "7290112498915",
      "name": "מאגדת מיני מגנום שקדים",
      "name_en": "Mini Magnum almond multipack",
      "category": "frozen",
      "quantity": 1.0,
      "unit": "each",
      "unit_price": 29.32,
      "total": 29.32,
      "size": null,
      "discount": null,
      "vat_exempt": false,
      "confidence": 0.95,
      "notes": null
    },
    {
      "line": 9,
      "barcode": "7290000554532",
      "name": "צפתית מעודנת 5%",
      "name_en": "Tzfatit cheese, light 5%",
      "category": "dairy_eggs",
      "quantity": 1.0,
      "unit": "each",
      "unit_price": 16.1,
      "total": 16.1,
      "size": null,
      "discount": null,
      "vat_exempt": false,
      "confidence": 0.95,
      "notes": null
    },
    {
      "line": 10,
      "barcode": "7290103992873",
      "name": "נייר טואלט 32 גליל",
      "name_en": "Toilet paper, 32 rolls",
      "category": "household",
      "quantity": 1.0,
      "unit": "each",
      "unit_price": 42.96,
      "total": 42.96,
      "size": null,
      "discount": null,
      "vat_exempt": false,
      "confidence": 0.95,
      "notes": null
    },
    {
      "line": 11,
      "barcode": "654959",
      "name": "עמק תנובה ישראל",
      "name_en": "Emek cheese, Tnuva",
      "category": "dairy_eggs",
      "quantity": 0.723,
      "unit": "kg",
      "unit_price": 38.22,
      "total": 27.63,
      "size": null,
      "discount": null,
      "vat_exempt": false,
      "confidence": 0.95,
      "notes": null
    },
    {
      "line": 12,
      "barcode": "4066600999614",
      "name": "פאולנר בקבוק זכ' 500 מ\"ל",
      "name_en": "Paulaner bottle 500ml",
      "category": "alcohol",
      "quantity": 1.0,
      "unit": "each",
      "unit_price": 11.35,
      "total": 11.35,
      "size": {
        "value": 500,
        "unit": "ml"
      },
      "discount": null,
      "vat_exempt": false,
      "confidence": 0.95,
      "notes": null
    }
  ],
  "totals": {
    "items_count": 12,
    "subtotal": 237.54,
    "discount_total": 0,
    "total": 237.54,
    "vat_rate": 0.18,
    "vat_amount": 36.23,
    "vat_taxable": 201.31,
    "vat_exempt": 0
  },
  "payment": {
    "method": "credit",
    "amount": 237.54,
    "change": 0,
    "card_brand": "ויזה כאל",
    "card_last4": "7462",
    "terminal": "2656917",
    "auth_code": null
  },
  "review": {
    "overall_confidence": 1.0,
    "needs_human_check": [],
    "notes": "Synthetic demo receipt generated by scripts/make_demo_data.py — not a real purchase."
  }
}
