{
  "schema_version": "1.0",
  "receipt_id": "2026-05-18_family-market_D00040518",
  "demo": true,
  "source_image": null,
  "scanned_at": "2026-05-18T17:05:00",
  "merchant": {
    "name": "י.א. פמילי מרקט בע\"מ",
    "name_en": "Y.A. Family Market Ltd",
    "slug": "family-market",
    "branch": "ניצני עוז",
    "tax_id": "515847747",
    "phone": null,
    "address": null
  },
  "document": {
    "type": "invoice_receipt",
    "number": "D00040518",
    "is_copy": false,
    "register": "1"
  },
  "purchased_at": "2026-05-18T17:05",
  "currency": "ILS",
  "items": [
    {
      "line": 1,
      "barcode": "122269",
      "name": "קבב הבית",
      "name_en": "House kebab",
      "category": "meat_fish",
      "quantity": 0.846,
      "unit": "kg",
      "unit_price": 62.14,
      "total": 52.57,
      "size": null,
      "discount": null,
      "vat_exempt": false,
      "confidence": 0.95,
      "notes": null
    },
    {
      "line": 2,
      "barcode": "654959",
      "name": "עמק תנובה ישראל",
      "name_en": "Emek cheese, Tnuva",
      "category": "dairy_eggs",
      "quantity": 0.427,
      "unit": "kg",
      "unit_price": 51.64,
      "total": 22.05,
      "size": null,
      "discount": null,
      "vat_exempt": false,
      "confidence": 0.95,
      "notes": null
    },
    {
      "line": 3,
      "barcode": "7290000119946",
      "name": "במבה אסם 80 גרם",
      "name_en": "Bamba 80g",
      "category": "snacks_sweets",
      "quantity": 1.0,
      "unit": "each",
      "unit_price": 4.72,
      "total": 4.72,
      "size": {
        "value": 80,
        "unit": "g"
      },
      "discount": null,
      "vat_exempt": false,
      "confidence": 0.95,
      "notes": null
    },
    {
      "line": 4,
      "barcode": "4066600999614",
      "name": "פאולנר בקבוק זכ' 500 מ\"ל",
      "name_en": "Paulaner bottle 500ml",
      "category": "alcohol",
      "quantity": 1.0,
      "unit": "each",
      "unit_price": 12.74,
      "total": 12.74,
      "size": {
        "value": 500,
        "unit": "ml"
      },
      "discount": null,
      "vat_exempt": false,
      "confidence": 0.95,
      "notes": null
    },
    {
      "line": 5,
      "barcode": "7290103992873",
      "name": "נייר טואלט 32 גליל",
      "name_en": "Toilet paper, 32 rolls",
      "category": "household",
      "quantity": 2.0,
      "unit": "each",
      "unit_price": 47.67,
      "total": 95.34,
      "size": null,
      "discount": null,
      "vat_exempt": false,
      "confidence": 0.95,
      "notes": null
    },
    {
      "line": 6,
      "barcode": "7290013558718",
      "name": "פטריות שמפניון א.א 300",
      "name_en": "Champignon mushrooms 300g",
      "category": "produce",
      "quantity": 1.0,
      "unit": "each",
      "unit_price": 11.79,
      "total": 11.79,
      "size": {
        "value": 300,
        "unit": "g"
      },
      "discount": null,
      "vat_exempt": false,
      "confidence": 0.95,
      "notes": null
    },
    {
      "line": 7,
      "barcode": "7290019049920",
      "name": "קולה זירו 1.5 ליטר",
      "name_en": "Cola Zero 1.5L",
      "category": "beverages",
      "quantity": 1.0,
      "unit": "each",
      "unit_price": 8.25,
      "total": 8.25,
      "size": {
        "value": 1.5,
        "unit": "l"
      },
      "discount": null,
      "vat_exempt": false,
      "confidence": 0.95,
      "notes": null
    },
    {
      "line": 8,
      "barcode": "7290110114923",
      "name": "עגבניות שרי 250 גרם",
      "name_en": "Cherry tomatoes 250g",
      "category": "produce",
      "quantity": 1.0,
      "unit": "each",
      "unit_price": 8.83,
      "total": 8.83,
      "size": {
        "value": 250,
        "unit": "g"
      },
      "discount": null,
      "vat_exempt": false,
      "confidence": 0.95,
      "notes": null
    },
    {
      "line": 9,
      "barcode": "7290000066318",
      "name": "ביצים L תבנית 12",
      "name_en": "Eggs L, tray of 12",
      "category": "dairy_eggs",
      "quantity": 2.0,
      "unit": "each",
      "unit_price": 15.62,
      "total": 31.24,
      "size": null,
      "discount": null,
      "vat_exempt": false,
      "confidence": 0.95,
      "notes": null
    },
    {
      "line": 10,
      "barcode": "7290008757775",
      "name": "שניצל עוף טרי",
      "name_en": "Fresh chicken schnitzel",
      "category": "meat_fish",
      "quantity": 0.968,
      "unit": "kg",
      "unit_price": 43.2,
      "total": 41.82,
      "size": null,
      "discount": null,
      "vat_exempt": false,
      "confidence": 0.95,
      "notes": null
    },
    {
      "line": 11,
      "barcode": "7290112498915",
      "name": "מאגדת מיני מגנום שקדים",
      "name_en": "Mini Magnum almond multipack",
      "category": "frozen",
      "quantity": 1.0,
      "unit": "each",
      "unit_price": 33.38,
      "total": 33.38,
      "size": null,
      "discount": null,
      "vat_exempt": false,
      "confidence": 0.95,
      "notes": null
    },
    {
      "line": 12,
      "barcode": "7290004720018",
      "name": "קוטג' תנובה 5%",
      "name_en": "Cottage cheese 5%",
      "category": "dairy_eggs",
      "quantity": 2.0,
      "unit": "each",
      "unit_price": 7.73,
      "total": 15.46,
      "size": null,
      "discount": null,
      "vat_exempt": false,
      "confidence": 0.95,
      "notes": null
    }
  ],
  "totals": {
    "items_count": 12,
    "subtotal": 338.19,
    "discount_total": 0,
    "total": 338.19,
    "vat_rate": 0.18,
    "vat_amount": 51.59,
    "vat_taxable": 286.6,
    "vat_exempt": 0
  },
  "payment": {
    "method": "credit",
    "amount": 338.19,
    "change": 0,
    "card_brand": "ויזה כאל",
    "card_last4": "7462",
    "terminal": "2656917",
    "auth_code": null
  },
  "review": {
    "overall_confidence": 1.0,
    "needs_human_check": [],
    "notes": "Synthetic demo receipt generated by scripts/make_demo_data.py — not a real purchase."
  }
}
