{
  "schema_version": "1.0",
  "receipt_id": "2026-08-05_shufersal_D00090805",
  "demo": true,
  "source_image": null,
  "scanned_at": "2026-08-05T19:52:00",
  "merchant": {
    "name": "שופרסל שלי",
    "name_en": "Shufersal Sheli",
    "slug": "shufersal",
    "branch": "כפר יונה",
    "tax_id": "520022732",
    "phone": null,
    "address": null
  },
  "document": {
    "type": "invoice_receipt",
    "number": "D00090805",
    "is_copy": false,
    "register": "1"
  },
  "purchased_at": "2026-08-05T19:52",
  "currency": "ILS",
  "items": [
    {
      "line": 1,
      "barcode": "7290013558718",
      "name": "פטריות שמפניון א.א 300",
      "name_en": "Champignon mushrooms 300g",
      "category": "produce",
      "quantity": 2.0,
      "unit": "each",
      "unit_price": 12.79,
      "total": 25.58,
      "size": {
        "value": 300,
        "unit": "g"
      },
      "discount": null,
      "vat_exempt": false,
      "confidence": 0.95,
      "notes": null
    },
    {
      "line": 2,
      "barcode": "7290110114923",
      "name": "עגבניות שרי 250 גרם",
      "name_en": "Cherry tomatoes 250g",
      "category": "produce",
      "quantity": 2.0,
      "unit": "each",
      "unit_price": 9.25,
      "total": 18.5,
      "size": {
        "value": 250,
        "unit": "g"
      },
      "discount": null,
      "vat_exempt": false,
      "confidence": 0.95,
      "notes": null
    },
    {
      "line": 3,
      "barcode": "7290000208831",
      "name": "שמן זית 750 מ\"ל",
      "name_en": "Olive oil 750ml",
      "category": "pantry",
      "quantity": 1.0,
      "unit": "each",
      "unit_price": 42.3,
      "total": 42.3,
      "size": {
        "value": 750,
        "unit": "ml"
      },
      "discount": null,
      "vat_exempt": false,
      "confidence": 0.95,
      "notes": null
    },
    {
      "line": 4,
      "barcode": "7290112498915",
      "name": "מאגדת מיני מגנום שקדים",
      "name_en": "Mini Magnum almond multipack",
      "category": "frozen",
      "quantity": 1.0,
      "unit": "each",
      "unit_price": 36.25,
      "total": 36.25,
      "size": null,
      "discount": null,
      "vat_exempt": false,
      "confidence": 0.95,
      "notes": null
    },
    {
      "line": 5,
      "barcode": "654959",
      "name": "עמק תנובה ישראל",
      "name_en": "Emek cheese, Tnuva",
      "category": "dairy_eggs",
      "quantity": 0.653,
      "unit": "kg",
      "unit_price": 56.34,
      "total": 36.79,
      "size": null,
      "discount": null,
      "vat_exempt": false,
      "confidence": 0.95,
      "notes": null
    },
    {
      "line": 6,
      "barcode": "7290019049920",
      "name": "קולה זירו 1.5 ליטר",
      "name_en": "Cola Zero 1.5L",
      "category": "beverages",
      "quantity": 2.0,
      "unit": "each",
      "unit_price": 8.9,
      "total": 17.8,
      "size": {
        "value": 1.5,
        "unit": "l"
      },
      "discount": null,
      "vat_exempt": false,
      "confidence": 0.95,
      "notes": null
    },
    {
      "line": 7,
      "barcode": "7290000554532",
      "name": "צפתית מעודנת 5%",
      "name_en": "Tzfatit cheese, light 5%",
      "category": "dairy_eggs",
      "quantity": 1.0,
      "unit": "each",
      "unit_price": 19.84,
      "total": 19.84,
      "size": null,
      "discount": null,
      "vat_exempt": false,
      "confidence": 0.95,
      "notes": null
    },
    {
      "line": 8,
      "barcode": "7290000537566",
      "name": "נקניקיות עוף 400 גרם",
      "name_en": "Chicken sausages 400g",
      "category": "meat_fish",
      "quantity": 1.0,
      "unit": "each",
      "unit_price": 16.42,
      "total": 16.42,
      "size": {
        "value": 400,
        "unit": "g"
      },
      "discount": null,
      "vat_exempt": false,
      "confidence": 0.95,
      "notes": null
    }
  ],
  "totals": {
    "items_count": 8,
    "subtotal": 213.48,
    "discount_total": 0,
    "total": 213.48,
    "vat_rate": 0.18,
    "vat_amount": 32.56,
    "vat_taxable": 180.92,
    "vat_exempt": 0
  },
  "payment": {
    "method": "credit",
    "amount": 213.48,
    "change": 0,
    "card_brand": "ויזה כאל",
    "card_last4": "7462",
    "terminal": "2656917",
    "auth_code": null
  },
  "review": {
    "overall_confidence": 1.0,
    "needs_human_check": [],
    "notes": "Synthetic demo receipt generated by scripts/make_demo_data.py — not a real purchase."
  }
}
