{
  "schema_version": "1.0",
  "receipt_id": "2026-07-21_rami-levy_D00080721",
  "demo": true,
  "source_image": null,
  "scanned_at": "2026-07-21T17:52:00",
  "merchant": {
    "name": "רמי לוי שיווק השקמה",
    "name_en": "Rami Levy",
    "slug": "rami-levy",
    "branch": "נתניה",
    "tax_id": "512534303",
    "phone": null,
    "address": null
  },
  "document": {
    "type": "invoice_receipt",
    "number": "D00080721",
    "is_copy": false,
    "register": "1"
  },
  "purchased_at": "2026-07-21T17:52",
  "currency": "ILS",
  "items": [
    {
      "line": 1,
      "barcode": "7290000066318",
      "name": "ביצים L תבנית 12",
      "name_en": "Eggs L, tray of 12",
      "category": "dairy_eggs",
      "quantity": 2.0,
      "unit": "each",
      "unit_price": 13.93,
      "total": 27.86,
      "size": null,
      "discount": null,
      "vat_exempt": false,
      "confidence": 0.95,
      "notes": null
    },
    {
      "line": 2,
      "barcode": "7290004720018",
      "name": "קוטג' תנובה 5%",
      "name_en": "Cottage cheese 5%",
      "category": "dairy_eggs",
      "quantity": 1.0,
      "unit": "each",
      "unit_price": 6.66,
      "total": 6.66,
      "size": null,
      "discount": null,
      "vat_exempt": false,
      "confidence": 0.95,
      "notes": null
    },
    {
      "line": 3,
      "barcode": "14201",
      "name": "מלפפון",
      "name_en": "Cucumber",
      "category": "produce",
      "quantity": 1.182,
      "unit": "kg",
      "unit_price": 6.36,
      "total": 7.52,
      "size": null,
      "discount": null,
      "vat_exempt": false,
      "confidence": 0.95,
      "notes": null
    },
    {
      "line": 4,
      "barcode": "7290000554532",
      "name": "צפתית מעודנת 5%",
      "name_en": "Tzfatit cheese, light 5%",
      "category": "dairy_eggs",
      "quantity": 1.0,
      "unit": "each",
      "unit_price": 13.36,
      "total": 13.36,
      "size": null,
      "discount": null,
      "vat_exempt": false,
      "confidence": 0.95,
      "notes": null
    },
    {
      "line": 5,
      "barcode": "654959",
      "name": "עמק תנובה ישראל",
      "name_en": "Emek cheese, Tnuva",
      "category": "dairy_eggs",
      "quantity": 0.651,
      "unit": "kg",
      "unit_price": 45.36,
      "total": 29.53,
      "size": null,
      "discount": null,
      "vat_exempt": false,
      "confidence": 0.95,
      "notes": null
    },
    {
      "line": 6,
      "barcode": "7290019049920",
      "name": "קולה זירו 1.5 ליטר",
      "name_en": "Cola Zero 1.5L",
      "category": "beverages",
      "quantity": 2.0,
      "unit": "each",
      "unit_price": 7.37,
      "total": 14.74,
      "size": {
        "value": 1.5,
        "unit": "l"
      },
      "discount": null,
      "vat_exempt": false,
      "confidence": 0.95,
      "notes": null
    },
    {
      "line": 7,
      "barcode": "7290008757775",
      "name": "שניצל עוף טרי",
      "name_en": "Fresh chicken schnitzel",
      "category": "meat_fish",
      "quantity": 0.567,
      "unit": "kg",
      "unit_price": 32.09,
      "total": 18.2,
      "size": null,
      "discount": null,
      "vat_exempt": false,
      "confidence": 0.95,
      "notes": null
    },
    {
      "line": 8,
      "barcode": "7290102393916",
      "name": "אורז בסמטי 1 ק\"ג",
      "name_en": "Basmati rice 1kg",
      "category": "pantry",
      "quantity": 1.0,
      "unit": "each",
      "unit_price": 12.37,
      "total": 12.37,
      "size": {
        "value": 1,
        "unit": "kg"
      },
      "discount": null,
      "vat_exempt": false,
      "confidence": 0.95,
      "notes": null
    },
    {
      "line": 9,
      "barcode": "7290011462000",
      "name": "חומוס ביתי /מטבחה/ירושל",
      "name_en": "Home-style hummus",
      "category": "deli_prepared",
      "quantity": 1.0,
      "unit": "each",
      "unit_price": 10.82,
      "total": 10.82,
      "size": null,
      "discount": null,
      "vat_exempt": false,
      "confidence": 0.95,
      "notes": null
    },
    {
      "line": 10,
      "barcode": "14210",
      "name": "עגבניות",
      "name_en": "Tomatoes",
      "category": "produce",
      "quantity": 0.45,
      "unit": "kg",
      "unit_price": 5.35,
      "total": 2.41,
      "size": null,
      "discount": null,
      "vat_exempt": false,
      "confidence": 0.95,
      "notes": null
    },
    {
      "line": 11,
      "barcode": "7290112498915",
      "name": "מאגדת מיני מגנום שקדים",
      "name_en": "Mini Magnum almond multipack",
      "category": "frozen",
      "quantity": 1.0,
      "unit": "each",
      "unit_price": 30.2,
      "total": 30.2,
      "size": null,
      "discount": null,
      "vat_exempt": false,
      "confidence": 0.95,
      "notes": null
    }
  ],
  "totals": {
    "items_count": 11,
    "subtotal": 173.67,
    "discount_total": 0,
    "total": 173.67,
    "vat_rate": 0.18,
    "vat_amount": 26.49,
    "vat_taxable": 147.18,
    "vat_exempt": 0
  },
  "payment": {
    "method": "credit",
    "amount": 173.67,
    "change": 0,
    "card_brand": "ויזה כאל",
    "card_last4": "7462",
    "terminal": "2656917",
    "auth_code": null
  },
  "review": {
    "overall_confidence": 1.0,
    "needs_human_check": [],
    "notes": "Synthetic demo receipt generated by scripts/make_demo_data.py — not a real purchase."
  }
}
