{
  "schema_version": "1.0",
  "receipt_id": "2026-07-06_family-market_D00070706",
  "demo": true,
  "source_image": null,
  "scanned_at": "2026-07-06T11:52:00",
  "merchant": {
    "name": "י.א. פמילי מרקט בע\"מ",
    "name_en": "Y.A. Family Market Ltd",
    "slug": "family-market",
    "branch": "ניצני עוז",
    "tax_id": "515847747",
    "phone": null,
    "address": null
  },
  "document": {
    "type": "invoice_receipt",
    "number": "D00070706",
    "is_copy": false,
    "register": "1"
  },
  "purchased_at": "2026-07-06T11:52",
  "currency": "ILS",
  "items": [
    {
      "line": 1,
      "barcode": "7290011462000",
      "name": "חומוס ביתי /מטבחה/ירושל",
      "name_en": "Home-style hummus",
      "category": "deli_prepared",
      "quantity": 2.0,
      "unit": "each",
      "unit_price": 12.35,
      "total": 24.7,
      "size": null,
      "discount": null,
      "vat_exempt": false,
      "confidence": 0.95,
      "notes": null
    },
    {
      "line": 2,
      "barcode": "7290004131074",
      "name": "חלב תנובה 3% ליטר",
      "name_en": "Tnuva milk 3% 1L",
      "category": "dairy_eggs",
      "quantity": 1.0,
      "unit": "each",
      "unit_price": 6.33,
      "total": 6.33,
      "size": {
        "value": 1,
        "unit": "l"
      },
      "discount": null,
      "vat_exempt": false,
      "confidence": 0.95,
      "notes": null
    },
    {
      "line": 3,
      "barcode": "7290000066318",
      "name": "ביצים L תבנית 12",
      "name_en": "Eggs L, tray of 12",
      "category": "dairy_eggs",
      "quantity": 2.0,
      "unit": "each",
      "unit_price": 16.02,
      "total": 32.04,
      "size": null,
      "discount": null,
      "vat_exempt": false,
      "confidence": 0.95,
      "notes": null
    },
    {
      "line": 4,
      "barcode": "7290019049920",
      "name": "קולה זירו 1.5 ליטר",
      "name_en": "Cola Zero 1.5L",
      "category": "beverages",
      "quantity": 1.0,
      "unit": "each",
      "unit_price": 8.38,
      "total": 8.38,
      "size": {
        "value": 1.5,
        "unit": "l"
      },
      "discount": null,
      "vat_exempt": false,
      "confidence": 0.95,
      "notes": null
    },
    {
      "line": 5,
      "barcode": "14210",
      "name": "עגבניות",
      "name_en": "Tomatoes",
      "category": "produce",
      "quantity": 0.752,
      "unit": "kg",
      "unit_price": 6.22,
      "total": 4.68,
      "size": null,
      "discount": null,
      "vat_exempt": false,
      "confidence": 0.95,
      "notes": null
    },
    {
      "line": 6,
      "barcode": "100103",
      "name": "בגט",
      "name_en": "Baguette",
      "category": "bakery",
      "quantity": 1.0,
      "unit": "each",
      "unit_price": 5.83,
      "total": 5.83,
      "size": null,
      "discount": null,
      "vat_exempt": false,
      "confidence": 0.95,
      "notes": null
    },
    {
      "line": 7,
      "barcode": "4066600999614",
      "name": "פאולנר בקבוק זכ' 500 מ\"ל",
      "name_en": "Paulaner bottle 500ml",
      "category": "alcohol",
      "quantity": 2.0,
      "unit": "each",
      "unit_price": 12.55,
      "total": 25.1,
      "size": {
        "value": 500,
        "unit": "ml"
      },
      "discount": null,
      "vat_exempt": false,
      "confidence": 0.95,
      "notes": null
    },
    {
      "line": 8,
      "barcode": "7290102393916",
      "name": "אורז בסמטי 1 ק\"ג",
      "name_en": "Basmati rice 1kg",
      "category": "pantry",
      "quantity": 1.0,
      "unit": "each",
      "unit_price": 14.32,
      "total": 14.32,
      "size": {
        "value": 1,
        "unit": "kg"
      },
      "discount": null,
      "vat_exempt": false,
      "confidence": 0.95,
      "notes": null
    },
    {
      "line": 9,
      "barcode": "7290110114923",
      "name": "עגבניות שרי 250 גרם",
      "name_en": "Cherry tomatoes 250g",
      "category": "produce",
      "quantity": 1.0,
      "unit": "each",
      "unit_price": 8.98,
      "total": 8.98,
      "size": {
        "value": 250,
        "unit": "g"
      },
      "discount": null,
      "vat_exempt": false,
      "confidence": 0.95,
      "notes": null
    },
    {
      "line": 10,
      "barcode": "7290112498915",
      "name": "מאגדת מיני מגנום שקדים",
      "name_en": "Mini Magnum almond multipack",
      "category": "frozen",
      "quantity": 2.0,
      "unit": "each",
      "unit_price": 34.1,
      "total": 68.2,
      "size": null,
      "discount": null,
      "vat_exempt": false,
      "confidence": 0.95,
      "notes": null
    },
    {
      "line": 11,
      "barcode": "7290004720018",
      "name": "קוטג' תנובה 5%",
      "name_en": "Cottage cheese 5%",
      "category": "dairy_eggs",
      "quantity": 1.0,
      "unit": "each",
      "unit_price": 7.92,
      "total": 7.92,
      "size": null,
      "discount": null,
      "vat_exempt": false,
      "confidence": 0.95,
      "notes": null
    }
  ],
  "totals": {
    "items_count": 11,
    "subtotal": 206.48,
    "discount_total": 0,
    "total": 206.48,
    "vat_rate": 0.18,
    "vat_amount": 31.5,
    "vat_taxable": 174.98,
    "vat_exempt": 0
  },
  "payment": {
    "method": "credit",
    "amount": 206.48,
    "change": 0,
    "card_brand": "ויזה כאל",
    "card_last4": "7462",
    "terminal": "2656917",
    "auth_code": null
  },
  "review": {
    "overall_confidence": 1.0,
    "needs_human_check": [],
    "notes": "Synthetic demo receipt generated by scripts/make_demo_data.py — not a real purchase."
  }
}
