{
  "schema_version": "1.0",
  "receipt_id": "2026-09-05_rami-levy_D00110905",
  "demo": true,
  "source_image": null,
  "scanned_at": "2026-09-05T11:52:00",
  "merchant": {
    "name": "רמי לוי שיווק השקמה",
    "name_en": "Rami Levy",
    "slug": "rami-levy",
    "branch": "נתניה",
    "tax_id": "512534303",
    "phone": null,
    "address": null
  },
  "document": {
    "type": "invoice_receipt",
    "number": "D00110905",
    "is_copy": false,
    "register": "1"
  },
  "purchased_at": "2026-09-05T11:52",
  "currency": "ILS",
  "items": [
    {
      "line": 1,
      "barcode": "7290110114923",
      "name": "עגבניות שרי 250 גרם",
      "name_en": "Cherry tomatoes 250g",
      "category": "produce",
      "quantity": 1.0,
      "unit": "each",
      "unit_price": 7.93,
      "total": 7.93,
      "size": {
        "value": 250,
        "unit": "g"
      },
      "discount": null,
      "vat_exempt": false,
      "confidence": 0.95,
      "notes": null
    },
    {
      "line": 2,
      "barcode": "7290011462000",
      "name": "חומוס ביתי /מטבחה/ירושל",
      "name_en": "Home-style hummus",
      "category": "deli_prepared",
      "quantity": 2.0,
      "unit": "each",
      "unit_price": 11.62,
      "total": 23.24,
      "size": null,
      "discount": null,
      "vat_exempt": false,
      "confidence": 0.95,
      "notes": null
    },
    {
      "line": 3,
      "barcode": "7290103992873",
      "name": "נייר טואלט 32 גליל",
      "name_en": "Toilet paper, 32 rolls",
      "category": "household",
      "quantity": 1.0,
      "unit": "each",
      "unit_price": 44.8,
      "total": 44.8,
      "size": null,
      "discount": null,
      "vat_exempt": false,
      "confidence": 0.95,
      "notes": null
    },
    {
      "line": 4,
      "barcode": "7290102393916",
      "name": "אורז בסמטי 1 ק\"ג",
      "name_en": "Basmati rice 1kg",
      "category": "pantry",
      "quantity": 1.0,
      "unit": "each",
      "unit_price": 12.82,
      "total": 12.82,
      "size": {
        "value": 1,
        "unit": "kg"
      },
      "discount": null,
      "vat_exempt": false,
      "confidence": 0.95,
      "notes": null
    },
    {
      "line": 5,
      "barcode": "122269",
      "name": "קבב הבית",
      "name_en": "House kebab",
      "category": "meat_fish",
      "quantity": 0.459,
      "unit": "kg",
      "unit_price": 56.83,
      "total": 26.08,
      "size": null,
      "discount": null,
      "vat_exempt": false,
      "confidence": 0.95,
      "notes": null
    },
    {
      "line": 6,
      "barcode": "7290019049920",
      "name": "קולה זירו 1.5 ליטר",
      "name_en": "Cola Zero 1.5L",
      "category": "beverages",
      "quantity": 1.0,
      "unit": "each",
      "unit_price": 7.22,
      "total": 7.22,
      "size": {
        "value": 1.5,
        "unit": "l"
      },
      "discount": null,
      "vat_exempt": false,
      "confidence": 0.95,
      "notes": null
    },
    {
      "line": 7,
      "barcode": "14201",
      "name": "מלפפון",
      "name_en": "Cucumber",
      "category": "produce",
      "quantity": 1.269,
      "unit": "kg",
      "unit_price": 6.3,
      "total": 7.99,
      "size": null,
      "discount": null,
      "vat_exempt": false,
      "confidence": 0.95,
      "notes": null
    },
    {
      "line": 8,
      "barcode": "4066600999614",
      "name": "פאולנר בקבוק זכ' 500 מ\"ל",
      "name_en": "Paulaner bottle 500ml",
      "category": "alcohol",
      "quantity": 1.0,
      "unit": "each",
      "unit_price": 10.99,
      "total": 10.99,
      "size": {
        "value": 500,
        "unit": "ml"
      },
      "discount": null,
      "vat_exempt": false,
      "confidence": 0.95,
      "notes": null
    },
    {
      "line": 9,
      "barcode": "7290000554532",
      "name": "צפתית מעודנת 5%",
      "name_en": "Tzfatit cheese, light 5%",
      "category": "dairy_eggs",
      "quantity": 2.0,
      "unit": "each",
      "unit_price": 16.31,
      "total": 32.62,
      "size": null,
      "discount": null,
      "vat_exempt": false,
      "confidence": 0.95,
      "notes": null
    },
    {
      "line": 10,
      "barcode": "14033",
      "name": "בצל יבש ישראל",
      "name_en": "Dry onion, Israel",
      "category": "produce",
      "quantity": 1.266,
      "unit": "kg",
      "unit_price": 6.06,
      "total": 7.67,
      "size": null,
      "discount": null,
      "vat_exempt": false,
      "confidence": 0.95,
      "notes": null
    },
    {
      "line": 11,
      "barcode": "7290004131074",
      "name": "חלב תנובה 3% ליטר",
      "name_en": "Tnuva milk 3% 1L",
      "category": "dairy_eggs",
      "quantity": 1.0,
      "unit": "each",
      "unit_price": 5.83,
      "total": 5.83,
      "size": {
        "value": 1,
        "unit": "l"
      },
      "discount": null,
      "vat_exempt": false,
      "confidence": 0.95,
      "notes": null
    },
    {
      "line": 12,
      "barcode": "14210",
      "name": "עגבניות",
      "name_en": "Tomatoes",
      "category": "produce",
      "quantity": 0.721,
      "unit": "kg",
      "unit_price": 5.37,
      "total": 3.87,
      "size": null,
      "discount": null,
      "vat_exempt": false,
      "confidence": 0.95,
      "notes": null
    }
  ],
  "totals": {
    "items_count": 12,
    "subtotal": 191.06,
    "discount_total": 0,
    "total": 191.06,
    "vat_rate": 0.18,
    "vat_amount": 29.14,
    "vat_taxable": 161.92,
    "vat_exempt": 0
  },
  "payment": {
    "method": "credit",
    "amount": 191.06,
    "change": 0,
    "card_brand": "ויזה כאל",
    "card_last4": "7462",
    "terminal": "2656917",
    "auth_code": null
  },
  "review": {
    "overall_confidence": 1.0,
    "needs_human_check": [],
    "notes": "Synthetic demo receipt generated by scripts/make_demo_data.py — not a real purchase."
  }
}
